occurrence id,location id,alert id,feed id,longitude,latitude,occurrence date,location name,precision,model eligible,validation weighting,geoname id,GAUL_code,title,publication date,url,feed name,language,summary,aegypti_suitability,albopictus_suitability,421934,15342,312366,59,-52,1,11/03/2011 14:01,"Amapa, Brazil",ADMIN1,t,1,3407762,667,". @ Minsaude recorded 1,049 indigenous cases of chikungunya fever until 7 March, with 459 in Bahia and 590 in Amapa. #coletivaLIRAa",11/03/2011 14:01,https://twitter.com/minsaude/statuses/576020178099707904,Ministry of Health Sites Twitter Portuguese,pt,".@minsaude registrou 1.049 casos autoctones de febre chikungunya, ate 7 de marco, sendo 459 na Bahia e 590 no Amapa.",0.576259576,0.138100142,377043,15752,271556,23,-51.06656,0.03446,16/01/2011 18:43,"Macapa, Amapa, Brazil",PRECISE,t,1,7280335,,"After 1 case of chikungunya in the capital, residents fear epidemic - Globo.com",16/01/2011 18:43,http://news.google.com/news/url?sa=t&fd=R&ct2=pt-PT_pt&usg=AFQjCNHqbc1DU0f4wDCwPaS6V7DZE88ulA&clid=c3a7d30bb8a4878e06b80cf16b898331&cid=52779127073835&ei=ZLm6VKDyDom6gwfQhIC4BQ&url=http://g1.globo.com/ap/amapa/noticia/2015/01/apos-1-caso-de-chikungunya-na-capital-moradores-temem-epidemia.html,Google News Portugues,pt,"Globo.com Apos 1o caso de chikungunya na capital, moradores temem epidemia Globo.com A notificacao do primeiro caso da febre chikungunya contraido em Macapa comecou a preocupar a populacao da capital, principalmente do bairro Infraero 2, na Zona Norte, onde um morador foi infectado. A reclamacao e sobre as lixeiras viciadas que se ...",0.942994057,0.942632145,421933,1422,312366,59,-42,-12,11/03/2011 14:01,"Bahia, Brazil",ADMIN1,t,1,3471168,669,". @ Minsaude recorded 1,049 indigenous cases of chikungunya fever until 7 March, with 459 in Bahia and 590 in Amapa. #coletivaLIRAa",11/03/2011 14:01,https://twitter.com/minsaude/statuses/576020178099707904,Ministry of Health Sites Twitter Portuguese,pt,".@minsaude registrou 1.049 casos autoctones de febre chikungunya, ate 7 de marco, sendo 459 na Bahia e 590 no Amapa.",0.388856335,0.589408082,428022,23337,316963,22,-38.96667,-12.26667,08/04/2011 10:40,"Feira de Santana, Bahia, Brazil",PRECISE,t,1,3463478,,"PRO/PORT> Chikungunya - Brasil (13) (BA), surto, atualizacao",08/04/2011 10:40,http://promedmail.org/direct.php?id=20150409.3286484,ProMED Portugues,pt,"Um novo boletim divulgado nesta quarta-feira (8) [abril/2015] pela Secretaria Municipal de Saude de Feira de Santana, cidade localizada a cerca de 100 quilometros de Salvador, revela que em 2015, foram registrados 540 casos suspeitos de Chikungunya, sendo que 172 (31,85%) foram confirmados. Em relacao ao local de ocorrencias, os dados destacam o bairro de Sitio Novo como a localidade com maior frequencia de casos suspeitos da doenca em 2015, com 87 casos.",0.923838762,0.887622861,377394,1421,271760,22,-47.92972,-15.77972,14/01/2011 23:49,"Distrito Federal, Brazil",PRECISE,t,1,3469058,,"PRO/PORT> Chikungunya - Brasil (05) (DF), caso confirmado, autoctone",14/01/2011 23:49,http://promedmail.org/direct.php?id=20150115.3095474,ProMED Portugues,pt,"A Secretaria de Saude do Distrito Federal informou nesta quinta-feira (15) [janeiro/2015] o registro do primeiro caso da febre chikungunya deste ano contraida na cidade [informado agora, em 2015, mas detectado e investigado quando? - Mod. RNA]. Um morador do Guara 2, cidade do Distrito Federal cerca de 10 quilometros distante de Brasilia, e considerado um caso de infeccao autoctone, ou seja, quando e contraida na propria cidade. Existem mais 2 casos em investigacao.",0.903589271,0.938508604,376486,1420,271212,22,-55,-21,07/01/2011 01:29,"Mato Grosso do Sul, Brazil",ADMIN1,t,1,3457415,676,"PRO/PORT> Chikungunya - Brasil, atualizacao, aumento do numero de casos",07/01/2011 01:29,http://promedmail.org/direct.php?id=20150107.3077729,ProMED Portugues,pt,"O numero de casos de Febre Chikungunya no Brasil aumentou 65% num periodo de um mes e meio. Boletim divulgado nesta quarta-feira [07/janeiro/2015], com registros ate 27 de dezembro [2014], mostra que ate agora foram contabilizados 2.258 pacientes com a doenca, provocada por um virus transmitido pela picada dos mosquitos _Aedes aegypti_ e _Aedes albopictus_. No boletim anterior, com dados ate 15 de novembro [2014], haviam sido contabilizadas 1.364 contaminacoes.",0.94229636,0.961843108,423850,1413,313519,2,-44,-18,25/03/2011 18:44,"Minas Gerais, Brazil",ADMIN1,t,1,3457153,677,"PRO/EDR> Chikungunya (07): Americas, Pacific",25/03/2011 18:44,http://promedmail.org/direct.php?id=20150326.3255954,ProMED Mail,,Cases by Country / Week / (Local Susp. / Local Conf. / Imported Conf.,0.526507698,0.864787125,377806,3059,271984,39,-74.33334,9,07/01/2011 12:10,"Departamento de Bolivar, Colombia",ADMIN1,t,1,3688650,938,Health alert decreed in Medellin for the Chikungunya virus - Cuba Ministry of Health,07/01/2011 12:10,http://boletinaldia.sld.cu/aldia/2015/01/08/decretan-alerta-sanitaria-en-medellin-por-virus-del-chikunguna/,Ministry of Health Sites Spanish,es,"Las autoridades sanitarias de la ciudad de Medellin (noroeste) decretaron este miercoles la alerta sanitaria para controlar la expansion del virus del chikunguna, confirmo el vicealcalde de salud de la ciudad, Juan Carlos Giraldo Salinas.",0.958939023,0.937232673,381640,13103,274388,9,-76.83333,2.5,16/02/2011 11:24,"Departamento del Cauca, Colombia",ADMIN1,t,1,3687029,944,Authorities confirmed 34 cases of Chikungunya and Dengue 10 ... - RCN Radio (press release) (blog),16/02/2011 11:24,http://news.google.com/news/url?sa=t&fd=R&ct2=es_us&usg=AFQjCNF74E0Uk8DE7ZXBia9mWqz4AnWpWQ&clid=c3a7d30bb8a4878e06b80cf16b898331&ei=bz7jVIDNEKC-3AGRWw&url=http://www.rcnradio.com/noticias/autoridades-confirman-34-casos-de-chikunguna-y-10-de-dengue-en-el-bordo-cauca-193404,Google News Espanol,es,"RCN Radio (Comunicado de prensa) (blog) Autoridades confirman 34 casos de Chikunguna y 10 de dengue en ... RCN Radio (Comunicado de prensa) (blog) Tras el reporte de 34 casos del virus Chikunguna en el Bordo - Patia, las autoridades de salud en el departamento del Cauca, desplegaron un operativo para enfrentar la situacion y ademas de garantizar la adecuada actuacion de la red hospitalaria, ...",0.24566224,0.788640379,412300,10260,304116,9,-75.75,2.5,24/02/2011 09:55,"Departamento del Huila, Colombia",ADMIN1,t,1,3680692,952,"The Huila with 17,928 patients Chikungunya and dengue 869 - The Nacion.com.co",24/02/2011 09:55,http://news.google.com/news/url?sa=t&fd=R&ct2=es_us&usg=AFQjCNH75f2m3F01RA5C5f3nuhaRretisw&clid=c3a7d30bb8a4878e06b80cf16b898331&ei=tZ_tVPD9Oceo3QHki4RA&url=http://www.lanacion.com.co/index.php/noticias-regional/huila/item/248560-el-huila-con-17-928-enfermos-de-chikunguna-y-869-con-dengue,Google News Espanol,es,"El Huila con 17.928 enfermos de Chikunguna y 869 con dengue La Nacion.com.co Avanzan las medidas para mitigar los efectos del virus de Chikunguna y dengue en el Huila. Se disparo nuevamente la cifra de enfermos del Chikunguna, se acerca los 18.000 casos y sigue creciendo por la propagacion del mosquito en Neiva, ...",0.464426717,0.366438802,377260,3083,271698,9,-75.66666,4.5,15/01/2011 19:58,"Departamento del Quindio, Colombia",ADMIN1,t,1,3671087,958,In Quindio report of the Chikungunya virus stabilization - Caracol Radio,15/01/2011 19:58,http://news.google.com/news/url?sa=t&fd=R&ct2=es&usg=AFQjCNHltMEChwMSoEIPTXQASc-Hwz4U5w&clid=c3a7d30bb8a4878e06b80cf16b898331&ei=UHG5VLCBJIXWwAGCwoDYCA&url=http://www.caracol.com.co/noticias/regionales/en-el-quindio-reportan-estabilizacion-del-virus-del-chicunguna/20150116/nota/2590957.aspx,Google News Espanol,es,"En el Quindio reportan estabilizacion del virus del chicunguna Caracol Radio Segun las autoridades de salud, fuera de los tres casos confirmados no se conocen mas contagiados. Caracol Radio | 16 de Enero de 2015. Y es que de acuerdo con el secretario de salud del Quindio Jose Antonio Correa fuera de los tres casos ...",0.350546557,0.478652404,377398,2108,271763,9,-76.5,3.75,14/01/2011 22:03,"Departamento del Valle del Cauca, Colombia",ADMIN1,t,1,3666313,964,Cases of the virus Chikinguna doubled in the Valley ... - Caracol Radio,14/01/2011 22:03,http://news.google.com/news/url?sa=t&fd=R&ct2=es&usg=AFQjCNEEVu1tkDqvL_Yb2myJnJ7SYeYEkg&clid=c3a7d30bb8a4878e06b80cf16b898331&ei=8Ui4VIDcC4-nwQGJ-oGgDA&url=http://www.caracol.com.co/noticias/regionales/se-duplicaron-los-casos-del-virus-del-chikinguna-en-el-valle-del-cauca/20150115/nota/2589579.aspx,Google News Espanol,es,"Se duplicaron los casos del virus del Chikinguna en el Valle del ... Caracol Radio Buga,Cartago, Palmira y Cali, las poblaciones que registran un alto numero de casos del virus del Chikunguna. Caracol Radio Cali | 15 de Enero de 2015. Ya son 304 los casos de reportados en el Valle del Cauca del virus del Chikunguna, siendo la ultima ...",0.546642162,0.561165258,377804,5367,271987,9,-75.53611,6.29139,03/01/2011 14:31,"Medellin, Antioquia, Colombia",PRECISE,t,1,3674962,,Health alert decreed in Medellin by Chikungunya - Terra Colombia,03/01/2011 14:31,"http://news.google.com/news/url?sa=t&fd=R&ct2=es&usg=AFQjCNEWfZZezoC5F8TwJLw7_M_bdTAWVw&clid=c3a7d30bb8a4878e06b80cf16b898331&cid=52779074377490&ei=656pVODEMsffgQe-8oGIAQ&url=http://noticias.terra.com.co/decretan-alerta-sanitaria-en-medellin-por-chikunguna,154bfe9b155ba410VgnVCM20000099cceb0aRCRD.html",Google News Espanol,es,"Decretan alerta sanitaria en Medellin por chikunguna Terra Colombia Las autoridades sanitarias de la ciudad decretaron la alerta sanitaria para controlar la expansion del virus del chikunguna, confirmo el secretario de salud local, Juan Carlos Giraldo Salinas. comentarios. El mosquito ""Aedes aegypti"" transmite la chikunguna ...",0.386378534,0.744584357,420995,1850,311857,2,-74.79639,10.96389,10/03/2011 18:21,"Barranquilla, Atlantico, Colombia",PRECISE,t,1,3689147,,"PRO/EDR> Chikungunya (06): Americas, Pacific",10/03/2011 18:21,http://promedmail.org/direct.php?id=20150311.3222368,ProMED Mail,,"Abstract -------- After an absence of about 200 years, chikungunya returned to the American tropics in 2013. The virus is maintained in a complex African zoonotic cycle but escapes into an urban cycle at 40- to 50-year intervals, causing global pandemics. In 1823, classical chikungunya, a viral exanthem in humans, occurred on Zanzibar, and in 1827, it arrived in the Caribbean and spread to North and South America.",0.954768861,0.742202488,381066,594,272536,5,-159.79069,-21.2331,11/02/2011 20:10,Cook Islands,COUNTRY,t,1,1899402,60,Chikungunya local transmission in Cook Islands prompts CDC travel notice - Outbreak News Today,11/02/2011 20:10,http://news.google.com/news/url?sa=t&fd=R&ct2=us&usg=AFQjCNEqwJ0HGnXBRGQQ5OZ2-J9G-K6Drg&clid=c3a7d30bb8a4878e06b80cf16b898331&cid=52778737880446&ei=pBTdVIj8N8qkwQH4v4DADg&url=http://outbreaknewstoday.com/chikungunya-local-transmission-in-cook-islands-prompts-cdc-travel-notice-32854/,Google News,,Chikungunya local transmission in Cook Islands prompts CDC travel notice Chikungunya local transmission in Cook Islands prompts CDC travel notice |,0.471201885,0.062277428,376623,168,271112,5,-84.18794,9.9702,21/01/2011 15:02,Costa Rica,COUNTRY,t,1,3624060,61,Chikungunya updates from Honduras and Costa Rica - Outbreak News Today,21/01/2011 15:02,http://news.google.com/news/url?sa=t&fd=R&ct2=us&usg=AFQjCNG57R5ND8IV2YrPemjsPW7bwn5qWw&clid=c3a7d30bb8a4878e06b80cf16b898331&ei=wh7BVOjTOvOrwAHUx4CgBw&url=http://outbreaknewstoday.com/chikungunya-updates-from-honduras-and-costa-rica-86409/,Google News,,"Chikungunya updates from Honduras and Costa Rica The mosquito borne virus, chikungunya has hit Central America pretty hard in recent months with a total of 170,000 suspected and confirmed autochthonous cases reported on the isthmus since local transmission was first seen in the Americas 13 months ago,",0.889529657,0.682409376,412687,22750,304387,54,-79.70151,0.96304,23/02/2011 17:51,"Esmeraldas, Esmeraldas Province, Ecuador",PRECISE,t,1,3657990,,"Michael Vera, National Director ofSNEM_MSP in Press conference reports first case of #chikungunya in Esmeraldas http://t.co/D2lmyjOY02",23/02/2011 17:51,https://twitter.com/Salud_Ec/statuses/570279897542885376,Ministry of Health Sites Twitter Spanish,es,"Michael Vera, Director Nacional de @SNEM_MSP en Rueda de prensa reporta primer caso de #chikungunya en Esmeraldas http://t.co/D2lmyjOY02",0.32118095,0.094188462,383183,857,275420,54,-89.18718,13.68935,01/02/2011 21:22,"San Salvador, San Salvador, El Salvador",PRECISE,t,1,3583361,,IN THIS MOMENT SystemPROCIVILSV Nac.de GREEN ALERT declares dengue and chik in 11 municipalities of #SanSalvador http://t.co/aeeKFzyUQo,01/02/2011 21:22,https://twitter.com/minsalud/statuses/562360502290894848,Ministry of Health Sites Twitter Spanish,es,EN ESTOS MOMENTOS Sistema Nac.de @PROCIVILSV declara ALERTA VERDE por dengue y chik en 11 municipios de #SanSalvador http://t.co/aeeKFzyUQo,0.89164795,0.558416569,382484,129,274933,62,-88.86651,13.7369,01/02/2011 21:30,El Salvador,COUNTRY,t,1,3585968,75,National Civil Protection System emits GREEN ALERT dengue and chikungunya ... - Ministry of Health of El Salvador&#39;s Facebook Wall,01/02/2011 21:30,http://www.facebook.com/salud.sv/photos/a.181487395207048.37244.181454861876968/864801286875652/?type=1,Ministry of Health Sites Facebook Spanish,es,Sistema Nacional de Proteccion Civil emite ALERTA VERDE por dengue y chikungunya en 11 municipios del departamento de #SanSalvador,0.893961022,0.849902825,382306,202,274813,10,-53,4,11/02/2011 12:56,"Region d'outre-mer de French Guiana, France",COUNTRY,t,1,,86,Chikungunya: first fatal case in Guyana - Why doctor?,11/02/2011 12:56,http://news.google.com/news/url?sa=t&fd=R&ct2=fr&usg=AFQjCNFeCPBuFTPMlufgK4bshGnodkZ0Gg&clid=c3a7d30bb8a4878e06b80cf16b898331&cid=52779254077069&ei=x6bcVJizFsKY3QH4hoGYDg&url=http://www.pourquoidocteur.fr/Chikungunya---premier-deces-en-Guyane-9784.html,Google News Francais,fr,"Pourquoi Docteur ? Chikungunya : premier cas mortel en Guyane Pourquoi Docteur ? Aucun deces n'avait ete impute directement au virus du chikungunya jusqu'a ce jour en Guyane >>, rapporte un communique de l'ARS. Chikungunya : premier cas ... Cette infection ne peut etre ni traitee, ni prevenue par un vaccin. Il est important de ...",0.271841606,0.227960752,377764,28068,271471,5,-139.49677,-8.94609,08/01/2011 01:42,"Marquesas Islands, French Polynesia",PRECISE,t,1,4019977,,Tahiti chikungunya claims 14 lives - Radio New Zealand,08/01/2011 01:42,http://news.google.com/news/url?sa=t&fd=R&ct2=us&usg=AFQjCNF_0xhttIy2nc5shcMhNocxH8Ansg&clid=c3a7d30bb8a4878e06b80cf16b898331&ei=dVKvVNjuF4XngAf0-4GgDQ&url=http://www.radionz.co.nz/international/pacific-news/263358/tahiti-chikungunya-claims-14-lives,Google News,,Tahiti chikungunya claims 14 lives Health officials in French Polynesia say a total of 14 people have died from the mosquito-borne disease chikungunya since the outbreak began in October.,0.351648028,0.110342875,376897,956,271470,5,-149.45979,-17.64079,09/01/2011 02:13,"Pays d'outre-mer de French Polynesia, France",COUNTRY,t,1,,87,Les formes post-aigues de chikungunya continue de progresser - La Depeche de Tahiti,09/01/2011 02:13,http://news.google.com/news/url?sa=t&fd=R&ct2=us&usg=AFQjCNEb7yLfraNbPyA7N8-R61Crnm-ykQ&clid=c3a7d30bb8a4878e06b80cf16b898331&cid=52779203670075&ei=HUS0VMCTOLPvwQHn44DQCw&url=http://www.ladepeche.pf/Les-formes-post-aig%25C3%25BCes-de-chikungunya-continue-de-progresser_a2569.html,Google News,,Les formes post-aigues de chikungunya continue de progresser Le dernier bulletin de veille sanitaire vient de paraitre et traite les donnees du 22 decembre au 4 janvier.,0.350945827,0.203391101,412562,41829,304330,5,-86,14.83333,26/02/2011 00:59,"Olancho, Honduras",ADMIN1,t,1,3604249,1434,Honduras registers first death from chikungunya virus - The Tico Times,26/02/2011 00:59,http://news.google.com/news/url?sa=t&fd=R&ct2=us&usg=AFQjCNEMLiWpukAxOgSlIzx5a0gUnn3GNQ&clid=c3a7d30bb8a4878e06b80cf16b898331&cid=52778749931418&ei=88HvVNnrGI6V3QGuqYGIBA&url=http://www.ticotimes.net/2015/02/26/honduras-registers-first-death-from-chikungunya-virus,Google News,,"Honduras registers first death from chikungunya virus Costa Rican Health Ministry officials said the Aedes albopictus mosquito, pictured here, and the Aedes aegypti - carriers of chikungunya - are both found across the country. (WikiMedia Commons).",0.139830213,0.373217893,424274,18718,313826,9,-86.56862,14.0273,26/03/2011 01:23,"Danli, Honduras",PRECISE,t,1,,,Danli reported 700 cases of dengue and chikungunya - The Tribuna.hn,26/03/2011 01:23,http://news.google.com/news/url?sa=t&fd=R&ct2=es_us&usg=AFQjCNER0qb5dozZL7EFPLJG-FNO9eRT6Q&clid=c3a7d30bb8a4878e06b80cf16b898331&ei=b8oUVZmjK-aq3AGYhoDoAg&url=http://www.latribuna.hn/2015/03/26/danli-reporta-700-casos-de-dengue-y-chikungunya/,Google News Espanol,es,"La Tribuna.hn Danli reporta 700 casos de dengue y chikungunya La Tribuna.hn DANLI, El Paraiso. La Region Departamental de Salud intensifico los operativos para disminuir los casos de dengue y chikungunya, los que reportan solo en Danli unos 700 casos. En esta ciudad se reporta el 80 por ciento de los casos de todo el ...",0.804071197,0.570069249,412905,41866,304526,5,165.5,-21.5,28/02/2011 12:27,"New Caledonia, New Caledonia",COUNTRY,t,1,2139685,178,Chikungunya update for the Americas and the Pacific Islands - Outbreak News Today,28/02/2011 12:27,http://news.google.com/news/url?sa=t&fd=R&ct2=us&usg=AFQjCNEItVlSfVH5FQ0L9TbpYEiOIPe0ew&clid=c3a7d30bb8a4878e06b80cf16b898331&ei=sg3zVIqhAsKw3QGnroPwAQ&url=http://outbreaknewstoday.com/chikungunya-update-for-the-americas-and-the-pacific-islands-67012/,Google News,,"Chikungunya update for the Americas and the Pacific Islands The chikungunya epidemic in the Western hemisphere has increased by 3,000 cases during the past week with the new tally at 1,247,000 since the first autochthonous cases were reported on the Caribbean island of St. Martin in December 2013.",0.473065874,0.735631511,423120,9592,313077,62,-57.5,-25.5,19/03/2011 15:52,"Departamento Central, Paraguay",ADMIN1,t,1,3439137,2318,"#Central, The department most affected by #Chikungunya - http: //bit.ly/19F67mZ ... - Ministry of Health Paraguay&#39;s Facebook Wall",19/03/2011 15:52,http://www.facebook.com/ministeriodesaludparaguay/photos/a.198644356874980.50194.139605509445532/837479916324751/?type=1,Ministry of Health Sites Facebook Spanish,es,"#Central, el departamento mas afectado por #Chikungunya - http://bit.ly/19F67mZ - Salud confirma 350 casos positivos en nuestro pais, 203 por laboratorio y 147 por nexo epidemiologico. - De estos, 306 corresponden a distritos del departamento Central. - Paraguari y San Pedro de Ykuamandyju se suman a la tabla.",0.841794978,0.916784984,431471,20745,319920,62,-57,-27,12/04/2011 17:10,"Departamento de Misiones, Paraguay",ADMIN1,t,1,3437727,2323,"Traveling with fever and disperse #Chikungunya * After Easter, new cases ... - Ministry of Health Paraguay&#39;s Facebook Wall",12/04/2011 17:10,http://www.facebook.com/ministeriodesaludparaguay/photos/a.198644356874980.50194.139605509445532/849905801748829/?type=1,Ministry of Health Sites Facebook Spanish,es,"Viajan con fiebre y dispersan #Chikungunya * Tras la Semana Santa, nuevos casos se registraron en Cordillera, Misiones y Paraguari. * A pesar de la recomendacion de reposar ante la presencia de cuadro febril. * Resaltan rapida deteccion, lo que permitio tomar medidas oportunas para evitar diseminacion. Salud reporta un total de 718 positivos a nivel pais. En la fecha, el informe de Vigilancia de la Salud de la cartera sanitaria incluyo un nuevo departamento a la lista de positivos de Chikungunya: Cordillera, con un caso confirmado. A este, se sumaron nuevos positivos en Paraguari y Misiones y, al hacer el estudio, pudo constatarse que febriles viajaron a estas zonas y dispersaron el virus, pese a las reiteradas recomendaciones de Salud Publica de guardar reposo en caso de contar con fiebre y/o confirmacion de la enfermedad. No obstante, gracias a la rapida deteccion, los equipos de Vigilancia de la Salud, de los servicios locales y del SENEPA, llevan a cabo las acciones pertinentes para evitar la diseminacion del virus en estos departamentos.",0.739219583,0.918074344,431472,46807,319920,62,-57.16667,-26,12/04/2011 17:10,"Departamento de Paraguari, Paraguay",ADMIN1,t,1,3437599,2325,"Traveling with fever and disperse #Chikungunya * After Easter, new cases ... - Ministry of Health Paraguay&#39;s Facebook Wall",12/04/2011 17:10,http://www.facebook.com/ministeriodesaludparaguay/photos/a.198644356874980.50194.139605509445532/849905801748829/?type=1,Ministry of Health Sites Facebook Spanish,es,"Viajan con fiebre y dispersan #Chikungunya * Tras la Semana Santa, nuevos casos se registraron en Cordillera, Misiones y Paraguari. * A pesar de la recomendacion de reposar ante la presencia de cuadro febril. * Resaltan rapida deteccion, lo que permitio tomar medidas oportunas para evitar diseminacion. Salud reporta un total de 718 positivos a nivel pais. En la fecha, el informe de Vigilancia de la Salud de la cartera sanitaria incluyo un nuevo departamento a la lista de positivos de Chikungunya: Cordillera, con un caso confirmado. A este, se sumaron nuevos positivos en Paraguari y Misiones y, al hacer el estudio, pudo constatarse que febriles viajaron a estas zonas y dispersaron el virus, pese a las reiteradas recomendaciones de Salud Publica de guardar reposo en caso de contar con fiebre y/o confirmacion de la enfermedad. No obstante, gracias a la rapida deteccion, los equipos de Vigilancia de la Salud, de los servicios locales y del SENEPA, llevan a cabo las acciones pertinentes para evitar la diseminacion del virus en estos departamentos.",0.758703709,0.96197703,424255,44459,313809,62,-57.567,-25.1,26/03/2011 17:05,"Villa Hayes, Presidente Hayes, Paraguay",PRECISE,t,1,3436725,,Ministry of Health confirmed 487 positive cases of #Chikungunya http: //bit.ly/1 ... - Ministry of Health Paraguay&#39;s Facebook Wall,26/03/2011 17:05,http://www.facebook.com/ministeriodesaludparaguay/photos/a.198644356874980.50194.139605509445532/841011269304949/?type=1,Ministry of Health Sites Facebook Spanish,es,"Ministerio de Salud confirma 487 casos positivos de #Chikungunya http://bit.ly/1xFIsNP - 109 mas desde el ultimo reporte. - Se adhiere la ciudad de Villa Hayes, con un positivo del virus. - Fernando de la Mora sigue liderando la tabla, con 141 confirmaciones.",0.855395095,0.946528537,423122,44362,313077,62,-57.07639,-24.09167,19/03/2011 15:52,"San Pedro (del Ycuamandiyu), San Pedro, Paraguay",PRECISE,t,1,3437021,,"#Central, The department most affected by #Chikungunya - http: //bit.ly/19F67mZ ... - Ministry of Health Paraguay&#39;s Facebook Wall",19/03/2011 15:52,http://www.facebook.com/ministeriodesaludparaguay/photos/a.198644356874980.50194.139605509445532/837479916324751/?type=1,Ministry of Health Sites Facebook Spanish,es,"#Central, el departamento mas afectado por #Chikungunya - http://bit.ly/19F67mZ - Salud confirma 350 casos positivos en nuestro pais, 203 por laboratorio y 147 por nexo epidemiologico. - De estos, 306 corresponden a distritos del departamento Central. - Paraguari y San Pedro de Ykuamandyju se suman a la tabla.",0.817456925,0.887517441,420118,44108,311344,9,-56.43333,-24.65,05/03/2011 18:38,"San Estanislao, San Pedro, Paraguay",PRECISE,t,1,3437105,,More Cities with Chikungunya - Paraguay.com,05/03/2011 18:38,http://news.google.com/news/url?sa=t&fd=R&ct2=es&usg=AFQjCNHOsRpf7gjCedm0ypswShgoh-0vEw&clid=c3a7d30bb8a4878e06b80cf16b898331&cid=52779156363845&ei=nAr6VLjMGKGKwQHIhYDIBw&url=http://www.paraguay.com/nacionales/mas-ciudades-con-brote-de-chikungunya-124826,Google News Espanol,es,"Paraguay.com Mas ciudades con brote de chikungunya Paraguay.com El virus Chikungunya avanzo esta semana a las ciudades de Aregua, con dos casos confirmados; Limpio, con un caso; y, uno en San Estanislao, segun el ultimo reporte de la Direccion General de Vigilancia de la Salud.",0.864136151,0.856598348,421834,44107,312325,62,-57.48562,-25.16611,05/03/2011 16:05,"Limpio, Central, Paraguay",PRECISE,t,1,3437842,,"Aregu&#xe1;, Limpio y Santan&#xed; se suman a la lista de ciudades con casos de #Chikungun... - Ministerio de Salud Paraguay's Facebook Wall",05/03/2011 16:05,http://www.facebook.com/ministeriodesaludparaguay/photos/a.198644356874980.50194.139605509445532/828836987189044/?type=1,Ministry of Health Sites Facebook Spanish,es,"Aregua, Limpio y Santani se suman a la lista de ciudades con casos de #Chikungunya - http://bit.ly/1waN4ug 63 nuevas confirmaciones esta semana. Totalizan 259 infectados con el virus, de los cuales 130 fueron confirmados por laboratorio y 129 por nexo epidemiologico. Se registra mayor dispersion en el Area Metropolitana de Asuncion.",0.896643042,0.927057746,424257,18099,313810,62,-57.54021,-25.32308,22/03/2011 18:11,"Fernando de la Mora, Central, Paraguay",PRECISE,t,1,3438115,,Fernando de la Mora and Villa Elisa continue with active outbreaks of #Chikungunya -... - Ministry of Health Paraguay&#39;s Facebook Wall,22/03/2011 18:11,http://www.facebook.com/ministeriodesaludparaguay/photos/a.198644356874980.50194.139605509445532/839048429501233/?type=1,Ministry of Health Sites Facebook Spanish,es,"Fernando de la Mora y Villa Elisa continuan con brotes activos de #Chikungunya - http://bit.ly/1EJVgCv - A la fecha, suman 378 casos positivos del virus a nivel pais. - Villa Elisa encabeza la lista, con 114 confirmaciones. - Le sigue Fernando de la Mora, con 96.",0.967675193,0.977170433,